{
  "bomFormat": "Voxelia-Release-SBOM",
  "bundledResources": [
    {
      "checksum": {
        "algorithm": "SHA-256",
        "value": "66bab1bc5bfb4f4528c0a0e2e6a0b2335f9323df4fd4798c3769ae556b774c65"
      },
      "owningTarget": "VoxeliaMetal",
      "path": "Sources/VoxeliaMetal/Resources/ShaderManifest.yaml",
      "processingRule": "process",
      "scope": "runtime"
    },
    {
      "checksum": {
        "algorithm": "SHA-256",
        "value": "0debcc2101ba6eae0c5fa1533437f297159aec340dae80706d808749eb89abca"
      },
      "owningTarget": "VoxeliaMetal",
      "path": "Sources/VoxeliaMetal/Resources/Shaders/Common/README.md",
      "processingRule": "process",
      "scope": "runtime"
    },
    {
      "checksum": {
        "algorithm": "SHA-256",
        "value": "e3b0c44298fc1c149afbf4c8996fb92427ae41e4649b934ca495991b7852b855"
      },
      "owningTarget": "VoxeliaMetal",
      "path": "Sources/VoxeliaMetal/Resources/Shaders/Compositing/.gitkeep",
      "processingRule": "process",
      "scope": "runtime"
    },
    {
      "checksum": {
        "algorithm": "SHA-256",
        "value": "e3b0c44298fc1c149afbf4c8996fb92427ae41e4649b934ca495991b7852b855"
      },
      "owningTarget": "VoxeliaMetal",
      "path": "Sources/VoxeliaMetal/Resources/Shaders/Imaging/.gitkeep",
      "processingRule": "process",
      "scope": "runtime"
    },
    {
      "checksum": {
        "algorithm": "SHA-256",
        "value": "e3b0c44298fc1c149afbf4c8996fb92427ae41e4649b934ca495991b7852b855"
      },
      "owningTarget": "VoxeliaMetal",
      "path": "Sources/VoxeliaMetal/Resources/Shaders/Picking/.gitkeep",
      "processingRule": "process",
      "scope": "runtime"
    },
    {
      "checksum": {
        "algorithm": "SHA-256",
        "value": "e3b0c44298fc1c149afbf4c8996fb92427ae41e4649b934ca495991b7852b855"
      },
      "owningTarget": "VoxeliaMetal",
      "path": "Sources/VoxeliaMetal/Resources/Shaders/Projection/.gitkeep",
      "processingRule": "process",
      "scope": "runtime"
    },
    {
      "checksum": {
        "algorithm": "SHA-256",
        "value": "e3b0c44298fc1c149afbf4c8996fb92427ae41e4649b934ca495991b7852b855"
      },
      "owningTarget": "VoxeliaMetal",
      "path": "Sources/VoxeliaMetal/Resources/Shaders/Resampling/.gitkeep",
      "processingRule": "process",
      "scope": "runtime"
    },
    {
      "checksum": {
        "algorithm": "SHA-256",
        "value": "e3b0c44298fc1c149afbf4c8996fb92427ae41e4649b934ca495991b7852b855"
      },
      "owningTarget": "VoxeliaMetal",
      "path": "Sources/VoxeliaMetal/Resources/Shaders/SurfaceRendering/.gitkeep",
      "processingRule": "process",
      "scope": "runtime"
    },
    {
      "checksum": {
        "algorithm": "SHA-256",
        "value": "e3b0c44298fc1c149afbf4c8996fb92427ae41e4649b934ca495991b7852b855"
      },
      "owningTarget": "VoxeliaMetal",
      "path": "Sources/VoxeliaMetal/Resources/Shaders/VolumeRendering/.gitkeep",
      "processingRule": "process",
      "scope": "runtime"
    },
    {
      "checksum": {
        "algorithm": "SHA-256",
        "value": "2317efa5e92ced3dee72fe947f77898b82c20f432e2e20c08f61ad2d734dc5cd"
      },
      "owningTarget": "VoxeliaTestSupport",
      "path": "Tests/Support/Resources/README.md",
      "processingRule": "process",
      "scope": "test"
    }
  ],
  "checksums": [
    {
      "algorithm": "SHA-256",
      "path": "LICENSE",
      "value": "744cf02040db2b51c4615804aceb0c8b812f8fc753369615a5d5c240f07bbdcf"
    },
    {
      "algorithm": "SHA-256",
      "path": "Package.resolved",
      "value": "986ce5bb5bb5cb4268c7c169a1ad70794c9068faf73cd63f56222e5f0d03fc3d"
    },
    {
      "algorithm": "SHA-256",
      "path": "Package.swift",
      "value": "468367cb50054ef25b9338bfc88196cfc33cd37dd04098b2232385481f4ef367"
    },
    {
      "algorithm": "SHA-256",
      "path": "RELEASE.json",
      "value": "a09f66213f5e78739ce8965166d0768a4a8145a7007c86b806fd096bdabdb2ea"
    },
    {
      "algorithm": "SHA-256",
      "path": "THIRD_PARTY_NOTICES.md",
      "value": "34ae57b7ba4dcd6fdd987947e28a5a79ad63e36972b24a0ff6d4d0b3c79bd877"
    },
    {
      "algorithm": "SHA-256",
      "path": "Tools/Schemas/VoxeliaSBOM.schema.json",
      "value": "d3248a56dc8659c8a92add4bf204fac158b1e5777b47fd50a3287d132abbb926"
    },
    {
      "algorithm": "SHA-256",
      "path": "Tools/Scripts/generate-sbom.sh",
      "value": "1d562dc44415865beeac5765ff9495bcee5375d576e1f5f3152c897cd4a53df4"
    },
    {
      "algorithm": "SHA-256",
      "path": "Tools/Scripts/generate_sbom.py",
      "value": "fd62960298039309d8bf9e66ab48fd87961659f90ed06d263b335573eac408de"
    },
    {
      "algorithm": "SHA-256",
      "path": "VERSION",
      "value": "80447316529fc62014fbaa047fb67c51ac30e32830cda370405349d8d66d196c"
    }
  ],
  "externalPackages": [
    {
      "distribution": "Optional module; linked only when VoxeliaDICOMKit is used",
      "identity": "compressionfamily",
      "licence": "MIT (owner grant 2026-08-06; licence file pending)",
      "location": "https://github.com/Raster-Lab/CompressionFamily.git",
      "optional": true,
      "resolvedRevision": "30fd74b6df841cf79b1a0247534a723f5e7ab4ba",
      "resolvedVersion": "1.0.0",
      "usage": [
        "VoxeliaDICOMKit (transitive, below the codec packages)"
      ]
    },
    {
      "distribution": "Optional module; linked only when VoxeliaDICOMKit is used",
      "identity": "dicomkit",
      "licence": "MIT",
      "location": "https://github.com/Raster-Lab/DICOMKit.git",
      "optional": true,
      "resolvedRevision": "93ef23e6553bfb33dcd267b8e54a6f03cc172cea",
      "resolvedVersion": "2.2.11",
      "usage": [
        "VoxeliaDICOMKit"
      ]
    },
    {
      "distribution": "Optional module; linked only when VoxeliaDICOMKit is used",
      "identity": "j2kswift",
      "licence": "MIT",
      "location": "https://github.com/Raster-Lab/J2KSwift.git",
      "optional": true,
      "resolvedRevision": "b1949084eeedaafb40bff8f1745bbab19e4bc36d",
      "resolvedVersion": "11.0.2",
      "usage": [
        "VoxeliaDICOMKit (transitive, via DICOMKit)"
      ]
    },
    {
      "distribution": "Optional module; linked only when VoxeliaDICOMKit is used",
      "identity": "jliswift",
      "licence": "Apache-2.0",
      "location": "https://github.com/Raster-Lab/JLISwift.git",
      "optional": true,
      "resolvedRevision": "9f1c6eb609fe6f26498db82b13df6b305630a374",
      "resolvedVersion": "0.5.0",
      "usage": [
        "VoxeliaDICOMKit (transitive, via DICOMKit)"
      ]
    },
    {
      "distribution": "Optional module; linked only when VoxeliaDICOMKit is used",
      "identity": "jlswift",
      "licence": "MIT (owner grant 2026-08-06; licence file pending)",
      "location": "https://github.com/Raster-Lab/JLSwift.git",
      "optional": true,
      "resolvedRevision": "53d902fec538e5c12f4ed9864c026be5da66b5dd",
      "resolvedVersion": "0.9.0",
      "usage": [
        "VoxeliaDICOMKit (transitive, via DICOMKit)"
      ]
    },
    {
      "distribution": "Optional module; linked only when VoxeliaDICOMKit is used",
      "identity": "jxlswift",
      "licence": "MIT",
      "location": "https://github.com/Raster-Lab/JXLSwift.git",
      "optional": true,
      "resolvedRevision": "760697a54dd253da8e8466c3fd09ecf2c2d89aec",
      "resolvedVersion": "1.4.0",
      "usage": [
        "VoxeliaDICOMKit (transitive, via DICOMKit)"
      ]
    },
    {
      "distribution": "Build-only; no Voxelia distribution target links it",
      "identity": "swift-argument-parser",
      "licence": "Apache-2.0",
      "location": "https://github.com/apple/swift-argument-parser.git",
      "optional": true,
      "resolvedRevision": "6a52f3251125d74daf04fcbd5e6f08a75d074382",
      "resolvedVersion": "1.8.2",
      "usage": [
        "VoxeliaDICOMKit (transitive, via DICOMKit executables)"
      ]
    }
  ],
  "licences": [
    {
      "checksum": {
        "algorithm": "SHA-256",
        "value": "744cf02040db2b51c4615804aceb0c8b812f8fc753369615a5d5c240f07bbdcf"
      },
      "component": "Voxelia",
      "source": "LICENSE",
      "spdxIdentifier": "MIT"
    }
  ],
  "metadata": {
    "platformPolicy": {
      "developmentHost": "Apple Silicon Mac running macOS and Xcode",
      "hardware": "Apple Silicon ARM64 only",
      "nonAppleSupport": false,
      "operatingSystems": [
        "macOS",
        "iOS",
        "iPadOS",
        "visionOS",
        "tvOS"
      ]
    },
    "project": "Voxelia",
    "release": "Repository and Package Scaffold",
    "releaseDate": "2026-08-02",
    "sourceRevision": {
      "commit": "b9e136caebae933a38d074a4625f708c66c995f4",
      "scope": "Checked-out source revision observed before writing the generated SBOM artifact.",
      "workingTreeDirty": true
    },
    "version": "0.1.1"
  },
  "optionalDependencies": [
    "compressionfamily",
    "dicomkit",
    "j2kswift",
    "jliswift",
    "jlswift",
    "jxlswift",
    "swift-argument-parser"
  ],
  "products": [
    {
      "name": "Voxelia",
      "targets": [
        "Voxelia"
      ],
      "type": "library"
    },
    {
      "name": "VoxeliaCPU",
      "targets": [
        "VoxeliaCPU"
      ],
      "type": "library"
    },
    {
      "name": "VoxeliaCore",
      "targets": [
        "VoxeliaCore"
      ],
      "type": "library"
    },
    {
      "name": "VoxeliaDICOMKit",
      "targets": [
        "VoxeliaDICOMKit"
      ],
      "type": "library"
    },
    {
      "name": "VoxeliaExecution",
      "targets": [
        "VoxeliaExecution"
      ],
      "type": "library"
    },
    {
      "name": "VoxeliaGeometry",
      "targets": [
        "VoxeliaGeometry"
      ],
      "type": "library"
    },
    {
      "name": "VoxeliaImaging",
      "targets": [
        "VoxeliaImaging"
      ],
      "type": "library"
    },
    {
      "name": "VoxeliaInteraction",
      "targets": [
        "VoxeliaInteraction"